{
  "$schema": "../../12_data_shapes/chain_v1.schema.json",
  "chain_ulid": "42BNRA395QD0641YYS1MNTNEW6",
  "chain_id_short": "tf22_03",
  "family": "TF22",
  "schema_version": 1,
  "name_en": "Product Unboxing Loop",
  "name_ar": "لوب فتح صندوق المنتج",
  "purpose": "Native product unboxing loop video. Hands-and-product interaction.",
  "models_used": [
    {
      "provider": "fal",
      "model_id": "—",
      "role": "primary_video_generation"
    }
  ],
  "input_schema": {
    "subject_description": {
      "type": "string",
      "description": "The subject (product, person, scene) to be rendered",
      "required": true,
      "min_length": 10
    },
    "duration_seconds": {
      "type": "integer",
      "description": "Target video duration in seconds",
      "required": false,
      "default": 6
    },
    "tone_descriptor": {
      "type": "string",
      "description": "Tone direction: contemplative, bold, warm, dignified, kinetic, etc.",
      "required": false
    }
  },
  "prompt_template": "— {cultural_constraints_injection} | Motion: Native product unboxing video of {product_descriptor}: hands carefully open premium packaging, reveal product inside, hold up for camera angle, soft natural daylight, hyper-realistic hands and packaging detail, no face visible, premium reveal pace, 6 seconds",
  "output_type": "video",
  "target_dimensions": {
    "width": 1080,
    "height": 1920,
    "aspect_ratio_label": "9:16",
    "duration_seconds": 6
  },
  "eligibility_filters": {
    "sectors_allowed": [
      "retail",
      "beauty",
      "f_and_b",
      "beauty_personal_care",
      "retail_lifestyle",
      "fashion",
      "food_and_beverage",
      "real_estate"
    ],
    "occasions_allowed": [
      "*"
    ],
    "quality_tiers_allowed": [
      "growth"
    ],
    "min_brand_maturity_days": 14
  },
  "cultural_constraints": {
    "requires_wardrobe_check": false,
    "requires_gesture_check": false,
    "requires_cultural_coherence_check": true,
    "requires_arabic_text_validation": false,
    "high_religious_sensitivity": false,
    "high_gender_sensitivity": false,
    "human_review_recommended_above_quality_tier": "never"
  },
  "cost_estimate_usd": 0.05,
  "latency_estimate_seconds": 60,
  "best_for_cd_brains": [
    "cd_03"
  ],
  "anti_patterns": [
    "Avoid trying to substitute with image-to-video fallback chain — native generation is the point"
  ],
  "notes": "Intents: grow, harvest. Source code in research corpus: V03. Saudi adaptation guidance: Default hands styled as Saudi/Arab. Critical: no face visible. Reference image: Required. Recommended frequency: 1 per week.",
  "provenance": {
    "source": "internal_research_corpus/OGz_2_0_ChainLibrary_v2_Complete.docx#TF22#V03",
    "date_added": "2026-05-13T15:30:00Z",
    "confirmer": "Mohamed",
    "confidence": "experimental",
    "scope": "universal"
  }
}